{
  "schema_version": "0.1.0",
  "stage": "verifier",
  "target": {
    "repository": "example-org/example-service",
    "pull_request_number": 42,
    "head_sha": "dddddddddddddddddddddddddddddddddddddddd",
    "base_sha": "bbbbbbbbbbbbbbbbbbbbbbbbbbbbbbbbbbbbbbbb",
    "base_ref": "main",
    "merge_base_sha": "cccccccccccccccccccccccccccccccccccccccc"
  },
  "review_context": {
    "review_kind": "follow_up",
    "baseline_report_id": "review-1",
    "baseline_fallback_reason": null,
    "change_stats": {
      "raw_files": 1,
      "raw_added_lines": 3,
      "raw_deleted_lines": 1,
      "effective_files": 1,
      "effective_added_lines": 3,
      "effective_deleted_lines": 1,
      "size_excluded_paths": []
    }
  },
  "context": {
    "documents": [
      {
        "source": {
          "source_id": "jira-description",
          "system": "jira",
          "uri": "https://jira.example.invalid/browse/EX-42",
          "observed_at": "2026-10-01T12:00:00Z",
          "type": "ticket"
        },
        "text": "Add a lookup endpoint. Invalid numeric identifiers must return HTTP 400."
      },
      {
        "source": {
          "source_id": "pr-description",
          "system": "github",
          "type": "pull_request",
          "uri": "https://github.com/example-org/example-service/pull/42",
          "observed_at": "2026-10-01T12:00:00Z",
          "actor": {
            "id": "user-1",
            "login": "author",
            "kind": "human",
            "is_pr_author": true
          }
        },
        "text": "Add the lookup endpoint required by EX-42. Test plan: CI plus manual invalid-identifier request."
      },
      {
        "source": {
          "source_id": "review-source-1",
          "system": "github",
          "type": "review",
          "uri": "https://github.com/example-org/example-service/pull/42#pullrequestreview-1",
          "observed_at": "2026-10-01T12:00:00Z",
          "actor": {
            "id": "bot-1",
            "login": "ai-reviewer",
            "kind": "bot",
            "is_pr_author": false
          }
        },
        "text": "AI review of the initial snapshot."
      },
      {
        "source": {
          "source_id": "100",
          "system": "github",
          "type": "review_comment",
          "uri": "https://github.com/example-org/example-service/pull/42#discussion_r100",
          "observed_at": "2026-10-01T12:00:00Z",
          "actor": {
            "id": "bot-1",
            "login": "ai-reviewer",
            "kind": "bot",
            "is_pr_author": false
          }
        },
        "text": "Invalid numeric identifiers return a server error. Finding: finding-11111111-1111-4111-8111-111111111111."
      },
      {
        "source": {
          "source_id": "author-reply",
          "system": "github",
          "type": "review_comment",
          "uri": "https://github.com/example-org/example-service/pull/42#discussion_rauthor-reply",
          "observed_at": "2026-10-01T12:00:00Z",
          "actor": {
            "id": "user-1",
            "login": "author",
            "kind": "human",
            "is_pr_author": true
          }
        },
        "text": "The route converter should reject non-numeric input before the handler. Please reassess finding-11111111-1111-4111-8111-111111111111."
      }
    ],
    "attachments": [],
    "pr": {
      "repository": "example-org/example-service",
      "number": 42,
      "title": "EX-42 Add lookup endpoint",
      "description": "Add the lookup endpoint required by EX-42. Test plan: CI plus manual invalid-identifier request.",
      "author": {
        "id": "user-1",
        "login": "author",
        "kind": "human",
        "is_pr_author": true
      },
      "state": "open",
      "draft": false,
      "source_id": "pr-description"
    },
    "jira_ticket": {
      "key": "EX-42",
      "title": "Add lookup endpoint",
      "description": "Add a lookup endpoint. Invalid numeric identifiers must return HTTP 400.",
      "source_id": "jira-description",
      "comments": []
    },
    "reviews": [
      {
        "review_id": "github-review-1",
        "source_id": "review-source-1",
        "author": {
          "id": "bot-1",
          "login": "ai-reviewer",
          "kind": "bot",
          "is_pr_author": false
        },
        "state": "COMMENTED",
        "commit_sha": "aaaaaaaaaaaaaaaaaaaaaaaaaaaaaaaaaaaaaaaa",
        "body": "AI review of the initial snapshot.",
        "submitted_at": "2026-10-01T12:00:00Z"
      }
    ],
    "review_threads": [
      {
        "thread_id": "thread-1",
        "review_id": "github-review-1",
        "is_resolved": false,
        "is_outdated": false,
        "comments": [
          {
            "comment_id": "100",
            "source_id": "100",
            "author": {
              "id": "bot-1",
              "login": "ai-reviewer",
              "kind": "bot",
              "is_pr_author": false
            },
            "body": "Invalid numeric identifiers return a server error. Finding: finding-11111111-1111-4111-8111-111111111111.",
            "created_at": "2026-10-01T12:00:00Z",
            "updated_at": "2026-10-01T12:00:00Z",
            "url": "https://github.com/example-org/example-service/pull/42#discussion_r100",
            "reply_to_comment_id": null,
            "review_id": "github-review-1",
            "thread_id": "thread-1"
          },
          {
            "comment_id": "author-reply",
            "source_id": "author-reply",
            "author": {
              "id": "user-1",
              "login": "author",
              "kind": "human",
              "is_pr_author": true
            },
            "body": "The route converter should reject non-numeric input before the handler. Please reassess finding-11111111-1111-4111-8111-111111111111.",
            "created_at": "2026-10-01T12:00:00Z",
            "updated_at": "2026-10-01T12:00:00Z",
            "url": "https://github.com/example-org/example-service/pull/42#discussion_rauthor-reply",
            "reply_to_comment_id": "100",
            "review_id": "github-review-1",
            "thread_id": "thread-1"
          }
        ]
      }
    ],
    "pr_comments": [],
    "sources": []
  },
  "mandatory_lenses": [
    {
      "lens_id": "security",
      "version": "1",
      "instructions": "Inspect changes for authorization failures, unsafe input handling, and exposure of protected data. Use the PR diff as the scope boundary."
    }
  ],
  "custom_rules": [],
  "fixture_patterns": [
    "fixtures/**"
  ],
  "prompt": {
    "prompt_id": "verification-assembled",
    "version": "1",